{
  "surrogateMethod": "cross_sectional_shuffle",
  "familyWise": true,
  "gridSize": 312,
  "iterations": 1000,
  "statistic": "sharpe",
  "realBest": 1.332,
  "surrogateMaxima": [1.21, 1.38, 1.44, 1.19, 1.51, 1.27, 1.33, 1.40, 1.18, 1.46],
  "surrogateMean": 1.337,
  "surr95": 1.384,
  "placeboP": 0.093,
  "pass": false,
  "seed": "onchain2-nvt-surr"
}
